{
  "schemaVersion": 1,
  "kind": "tinysdd-instruction-evidence-card",
  "id": "thinkingcap-write-tests-titan-medium16k-v1",
  "version": 1,
  "state": "inconclusive",
  "model": {
    "id": "titan/llamacpp/thinkingcap-q4km-128k",
    "version": "UNKNOWN",
    "quantization": "UNKNOWN"
  },
  "configuration": "route=titan/llamacpp/thinkingcap-q4km-128k;thinking=medium;maxTokens=16384;contextWindow=128000;timeoutMs=600000;maxToolCalls=100;maxCheckRuns=12;fallbacks=disabled",
  "role": "write-tests",
  "synthetic": false,
  "identities": {
    "source": {
      "repository": "ivo-toby/tiny-sdd",
      "revision": "02c661dd8f851e16235ecdf5d730b2a9f678d3b8",
      "path": "profiles/instructions/_evidence/source-02c661d.json",
      "sha256": "e6c23a3d98bf34d3055a2e8c5823095106746ce9563590980c9d70ca3bbef9bf"
    },
    "suite": {
      "id": "instruction-write-tests-expanded-v2",
      "version": "2026-10-19.expanded-v3-writing-discovery",
      "path": "profiles/instructions/_evidence/suite-write-tests-2026-10-19.json",
      "sha256": "68951428441bc019fd78c1c3c1974db77376bb5ea5fd1d5fa60c99a472cacb39"
    },
    "profiles": {
      "baseline": {
        "path": "profiles/instructions/thinkingcap/titan-llamacpp-thinkingcap-q4km-128k/write-tests/v1/baseline-profile.json",
        "sha256": "74830e939af5eeabfac408119ab258e0f3c87ececcdd3c04d84a95718791e625"
      },
      "candidate": {
        "path": "profiles/instructions/thinkingcap/titan-llamacpp-thinkingcap-q4km-128k/write-tests/v1/candidate-profile.json",
        "sha256": "a38b6fd18e65066b09c2e2f3912e1bc6275e9942dfb8770ea7c31b2ba944eacf"
      }
    },
    "settings": {
      "baseline": {
        "path": "profiles/instructions/_evidence/settings-thinkingcap-write-tests-2026-10-19.json",
        "sha256": "c11d3e2110436785948967beb16f17e853c6e1871e8238a9a0adf0efbe7094f6"
      },
      "candidate": {
        "path": "profiles/instructions/_evidence/settings-thinkingcap-write-tests-2026-10-19.json",
        "sha256": "c11d3e2110436785948967beb16f17e853c6e1871e8238a9a0adf0efbe7094f6"
      }
    }
  },
  "settings": {
    "requestedThinking": "medium",
    "maxTokens": 16384,
    "contextWindow": 128000,
    "limits": {
      "timeoutMs": 600000,
      "maxToolCalls": 100,
      "maxCheckRuns": 12,
      "firstWriteMs": "UNKNOWN"
    },
    "server": {
      "id": "UNKNOWN",
      "version": "UNKNOWN"
    }
  },
  "promptHashes": {
    "before": "e3b0c44298fc1c149afbf4c8996fb92427ae41e4649b934ca495991b7852b855",
    "after": "e3c34fcb5b672dfd429e3a29bf3f8598735adb715b0e5994526aba6f4d69c014"
  },
  "evidence": {
    "report": {
      "path": "profiles/instructions/_evidence/report-thinkingcap-write-tests-2026-10-19.json",
      "sha256": "e867f76aaae344c679ec6c418181f1de14a4fdbb2a5ae2e09bb0db18219b207f"
    },
    "protocol": "profiles/instructions/_evidence/protocol-thinkingcap-write-tests-2026-10-19.json",
    "partitions": {
      "discovery": {
        "partition": "discovery",
        "state": "tested-improved",
        "challengeCount": 5,
        "repetitions": 2,
        "pairs": {
          "scheduled": 10,
          "complete": 10,
          "missing": 0
        },
        "A": {
          "success": 6,
          "failure": 4,
          "unknown": 0,
          "scheduled": 10
        },
        "B": {
          "success": 8,
          "failure": 2,
          "unknown": 0,
          "scheduled": 10
        },
        "gains": {
          "quality": 2,
          "integration": "UNKNOWN",
          "netQualityRate": 0.2
        },
        "regressions": {
          "quality": 0,
          "integration": "UNKNOWN",
          "combined": 0
        },
        "missingData": [
          {
            "field": "integration",
            "reason": "No integration checks were mapped in the plan; integration remains UNKNOWN."
          },
          {
            "field": "controlQualification",
            "reason": "The candidate was frozen before the primary static control audit, but the analyst was not blinded to the old control source; strict same-analyst untouched control qualification is unavailable."
          }
        ]
      },
      "control": {
        "partition": "control",
        "state": "no-improvement",
        "challengeCount": 2,
        "repetitions": 2,
        "pairs": {
          "scheduled": 4,
          "complete": 4,
          "missing": 0
        },
        "A": {
          "success": 4,
          "failure": 0,
          "unknown": 0,
          "scheduled": 4
        },
        "B": {
          "success": 4,
          "failure": 0,
          "unknown": 0,
          "scheduled": 4
        },
        "gains": {
          "quality": 0,
          "integration": "UNKNOWN",
          "netQualityRate": 0
        },
        "regressions": {
          "quality": 0,
          "integration": "UNKNOWN",
          "combined": 0
        },
        "missingData": [
          {
            "field": "integration",
            "reason": "No integration checks were mapped in the plan; integration remains UNKNOWN."
          },
          {
            "field": "controlQualification",
            "reason": "The candidate was frozen before the primary static control audit, but the analyst was not blinded to the old control source; strict same-analyst untouched control qualification is unavailable."
          }
        ]
      }
    },
    "criteria": {
      "minPairsPerPartition": 4,
      "minQualityGain": 0.1,
      "maxRegressions": 0,
      "rationale": "Predeclared descriptive pilot; not population proof or acceptance."
    }
  },
  "independentVerification": {
    "status": "verified",
    "refs": [
      {
        "path": "profiles/instructions/_evidence/review-thinkingcap-write-tests-2026-10-19.json",
        "sha256": "422122a90b2a233d1ca6ea3176384caff2b0f24c27dc5876564f82c6aa691253"
      },
      {
        "path": "profiles/instructions/_evidence/report-thinkingcap-write-tests-2026-10-19.json",
        "sha256": "e867f76aaae344c679ec6c418181f1de14a4fdbb2a5ae2e09bb0db18219b207f"
      }
    ]
  },
  "review": {
    "reviewer": "primary",
    "refs": [
      {
        "path": "profiles/instructions/_evidence/review-thinkingcap-write-tests-2026-10-19.json",
        "sha256": "422122a90b2a233d1ca6ea3176384caff2b0f24c27dc5876564f82c6aa691253"
      }
    ],
    "exactBytesMatched": true,
    "sourceVerified": true
  },
  "limitations": [
    "The retained experimental report is no-improvement, but this card is inconclusive for strict applicability validation because the analyst saw the old control source after candidate B was frozen.",
    "Previously inspected controls cannot serve as untouched controls for the same analyst; retain the baseline pending a fresh blind replication.",
    "The Birch .value comparator is mutation-specific fault coverage because the public contract does not require that member field; it does not establish general inability to write ordering tests.",
    "This is exploratory frozen-prompt evidence; two AB/BA repetitions are correlated and do not establish population effectiveness.",
    "Both control arms pass 4/4 at ceiling; no transferred gain is established.",
    "Backend version, quantization and server-side thinking enforcement are UNKNOWN; the route alias and requested settings do not establish backend identity.",
    "No integration metric mapping was supplied; integration remains UNKNOWN.",
    "Primary review checked 28 reference cases and 108 mutation checks: 28 reference checks passed, 102 mutation checks passed and 6 failed. This is verifier evidence, not a claim that every candidate is correct.",
    "The source archive is externally byte-bound to source commit 02c661dd8f851e16235ecdf5d730b2a9f678d3b8; runtime tinySdd codeRevision remains UNKNOWN.",
    "The candidate instructions are appended to the built-in harness and require an exact-match review before selection."
  ],
  "recommendation": "gather-more"
}
