{
  "schemaVersion": 1,
  "kind": "tinysdd-instruction-evidence-card",
  "id": "qwen36-implement-slice-titan-medium16k-v1",
  "version": 1,
  "state": "proposed",
  "model": {
    "id": "titan/llamacpp/qwen3.6-35b-a3b-256k",
    "version": "UNKNOWN",
    "quantization": "UNKNOWN"
  },
  "configuration": "route=titan/llamacpp/qwen3.6-35b-a3b-256k;thinking=medium;maxTokens=16384;contextWindow=256000;timeoutMs=600000;maxToolCalls=100;maxCheckRuns=12;fallbacks=disabled",
  "role": "implement-slice",
  "synthetic": false,
  "identities": {
    "source": {
      "repository": "ivo-toby/tiny-sdd",
      "revision": "02c661dd8f851e16235ecdf5d730b2a9f678d3b8",
      "path": "profiles/instructions/_evidence/source-02c661d.json",
      "sha256": "e6c23a3d98bf34d3055a2e8c5823095106746ce9563590980c9d70ca3bbef9bf"
    },
    "suite": {
      "id": "instruction-implement-expanded-v2",
      "version": "2026-10-19.sparse-visible-presence-transfer-v2",
      "path": "profiles/instructions/_evidence/suite-implement-slice-2026-10-19.json",
      "sha256": "7b54994acc6fe6c7c2e10810eac64bcfb328d32e92c41b8df2ac74e375433936"
    },
    "profiles": {
      "baseline": {
        "path": "profiles/instructions/qwen36/titan-llamacpp-qwen3_6-35b-a3b-256k/implement-slice/v1/baseline-profile.json",
        "sha256": "74830e939af5eeabfac408119ab258e0f3c87ececcdd3c04d84a95718791e625"
      },
      "candidate": {
        "path": "profiles/instructions/qwen36/titan-llamacpp-qwen3_6-35b-a3b-256k/implement-slice/v1/candidate-profile.json",
        "sha256": "ec262e77077d8d49172746504cd12eb2c9754b730a3bdca6439af5e01a6f9971"
      }
    },
    "settings": {
      "baseline": {
        "path": "profiles/instructions/_evidence/settings-qwen36.json",
        "sha256": "f5f6f7dfcfdda7df3f16608d0d4ba2ecee4426d942a756b7db7d68a62fe08cc7"
      },
      "candidate": {
        "path": "profiles/instructions/_evidence/settings-qwen36.json",
        "sha256": "f5f6f7dfcfdda7df3f16608d0d4ba2ecee4426d942a756b7db7d68a62fe08cc7"
      }
    }
  },
  "settings": {
    "requestedThinking": "medium",
    "maxTokens": 16384,
    "contextWindow": 256000,
    "limits": {
      "timeoutMs": 600000,
      "maxToolCalls": 100,
      "maxCheckRuns": 12,
      "firstWriteMs": "UNKNOWN"
    },
    "server": {
      "id": "UNKNOWN",
      "version": "UNKNOWN"
    }
  },
  "promptHashes": {
    "before": "e3b0c44298fc1c149afbf4c8996fb92427ae41e4649b934ca495991b7852b855",
    "after": "b17033079cb097f18ca280936ca175a403b5449ccdbadee54295a16000be417d"
  },
  "evidence": null,
  "independentVerification": {
    "status": "unverified",
    "refs": [
      {
        "path": "profiles/instructions/_evidence/proposal-qwen36.json",
        "sha256": "2a42239baff27731eda7ca5c25284d2183f04f015ac2b00122416e65ae86af69"
      }
    ]
  },
  "review": {
    "reviewer": "UNKNOWN",
    "refs": [],
    "exactBytesMatched": false,
    "sourceVerified": false
  },
  "limitations": [
    "No controlled A/B evidence has been run or independently verified; this card is a proposal only.",
    "Model version, quantization and server enforcement are UNKNOWN; the route alias and requested settings do not establish backend identity.",
    "THINKING_CONTROL_MISMATCH is recorded in the prepared settings metadata; server enforcement remains unverified.",
    "The candidate instructions are appended to the built-in harness and require an exact-match review before selection."
  ],
  "recommendation": "gather-more"
}
