{
  "schemaVersion": 1,
  "kind": "tinysdd-instruction-evidence-card",
  "id": "gemma12-implement-slice-titan-medium16k-v1",
  "version": 1,
  "state": "proposed",
  "model": {
    "id": "titan/llamacpp/gemma4-12b-128k",
    "version": "UNKNOWN",
    "quantization": "UNKNOWN"
  },
  "configuration": "route=titan/llamacpp/gemma4-12b-128k;thinking=medium;maxTokens=16384;contextWindow=128000;timeoutMs=600000;maxToolCalls=100;maxCheckRuns=12;fallbacks=disabled",
  "role": "implement-slice",
  "synthetic": false,
  "identities": {
    "source": {
      "repository": "ivo-toby/tiny-sdd",
      "revision": "02c661dd8f851e16235ecdf5d730b2a9f678d3b8",
      "path": "profiles/instructions/_evidence/source-02c661d.json",
      "sha256": "e6c23a3d98bf34d3055a2e8c5823095106746ce9563590980c9d70ca3bbef9bf"
    },
    "suite": {
      "id": "instruction-implement-expanded-v2",
      "version": "2026-10-19.sparse-visible-presence-transfer-v2",
      "path": "profiles/instructions/_evidence/suite-implement-slice-2026-10-19.json",
      "sha256": "7b54994acc6fe6c7c2e10810eac64bcfb328d32e92c41b8df2ac74e375433936"
    },
    "profiles": {
      "baseline": {
        "path": "profiles/instructions/gemma12/titan-llamacpp-gemma4-12b-128k/implement-slice/v1/baseline-profile.json",
        "sha256": "74830e939af5eeabfac408119ab258e0f3c87ececcdd3c04d84a95718791e625"
      },
      "candidate": {
        "path": "profiles/instructions/gemma12/titan-llamacpp-gemma4-12b-128k/implement-slice/v1/candidate-profile.json",
        "sha256": "1ae80ff040491ceb3fc9de3d29046e08f26869862407f30859f7a3d9eccfa3f2"
      }
    },
    "settings": {
      "baseline": {
        "path": "profiles/instructions/_evidence/settings-gemma12.json",
        "sha256": "06e498e7bc023e0d8060934d688ea0b8f28fc5060a26208a238001575b6a56f9"
      },
      "candidate": {
        "path": "profiles/instructions/_evidence/settings-gemma12.json",
        "sha256": "06e498e7bc023e0d8060934d688ea0b8f28fc5060a26208a238001575b6a56f9"
      }
    }
  },
  "settings": {
    "requestedThinking": "medium",
    "maxTokens": 16384,
    "contextWindow": 128000,
    "limits": {
      "timeoutMs": 600000,
      "maxToolCalls": 100,
      "maxCheckRuns": 12,
      "firstWriteMs": "UNKNOWN"
    },
    "server": {
      "id": "UNKNOWN",
      "version": "UNKNOWN"
    }
  },
  "promptHashes": {
    "before": "e3b0c44298fc1c149afbf4c8996fb92427ae41e4649b934ca495991b7852b855",
    "after": "383922ff9646311e700ee46572c9ff0527ff055c8e01b3ae6223bee5c0d5a07a"
  },
  "evidence": null,
  "independentVerification": {
    "status": "unverified",
    "refs": [
      {
        "path": "profiles/instructions/_evidence/proposal-gemma12.json",
        "sha256": "3ac260070e6cd8b054f7dbd0187b26e75b8fc22c5083550515c216198be6f255"
      }
    ]
  },
  "review": {
    "reviewer": "UNKNOWN",
    "refs": [],
    "exactBytesMatched": false,
    "sourceVerified": false
  },
  "limitations": [
    "No controlled A/B evidence has been run or independently verified; this card is a proposal only.",
    "Model version, quantization and server enforcement are UNKNOWN; the route alias and requested settings do not establish backend identity.",
    "THINKING_CONTROL_MISMATCH is recorded in the prepared settings metadata; server enforcement remains unverified.",
    "The candidate instructions are appended to the built-in harness and require an exact-match review before selection."
  ],
  "recommendation": "gather-more"
}
