{
  "schemaVersion": 1,
  "kind": "tinysdd-instruction-evidence-card",
  "id": "gemma26-implement-slice-titan-medium16k-v1",
  "version": 1,
  "state": "proposed",
  "model": {
    "id": "titan/llamacpp/gemma4-26b-a4b-128k",
    "version": "UNKNOWN",
    "quantization": "UNKNOWN"
  },
  "configuration": "route=titan/llamacpp/gemma4-26b-a4b-128k;thinking=medium;maxTokens=16384;contextWindow=128000;timeoutMs=600000;maxToolCalls=100;maxCheckRuns=12;fallbacks=disabled",
  "role": "implement-slice",
  "synthetic": false,
  "identities": {
    "source": {
      "repository": "ivo-toby/tiny-sdd",
      "revision": "02c661dd8f851e16235ecdf5d730b2a9f678d3b8",
      "path": "profiles/instructions/_evidence/source-02c661d.json",
      "sha256": "9165877db856014575293a7541ba9047f0998a71d9e6edd5e3e4a86f09d932fa"
    },
    "suite": {
      "id": "model-study-implement-v1",
      "version": "2026-10-19.2",
      "path": "profiles/instructions/_evidence/suite-implement-slice-2026-10-19.json",
      "sha256": "e99e74f6f1367c10a3b571172832781c7abd78afad8ff44f288a7c4a4435c2de"
    },
    "profiles": {
      "baseline": {
        "path": "profiles/instructions/gemma26/titan-llamacpp-gemma4-26b-a4b-128k/implement-slice/v1/baseline-profile.json",
        "sha256": "74830e939af5eeabfac408119ab258e0f3c87ececcdd3c04d84a95718791e625"
      },
      "candidate": {
        "path": "profiles/instructions/gemma26/titan-llamacpp-gemma4-26b-a4b-128k/implement-slice/v1/candidate-profile.json",
        "sha256": "2c3e5590684d3a9e95dc94b3f06bb315d6e3248ad9ac9a32c57d728f9d3e69db"
      }
    },
    "settings": {
      "baseline": {
        "path": "profiles/instructions/_evidence/settings-gemma26.json",
        "sha256": "fa42b6f0ee6d946f81d8d1ac4c3d09c6786c7106dd7a0dda786c87fe06fedd2b"
      },
      "candidate": {
        "path": "profiles/instructions/_evidence/settings-gemma26.json",
        "sha256": "fa42b6f0ee6d946f81d8d1ac4c3d09c6786c7106dd7a0dda786c87fe06fedd2b"
      }
    }
  },
  "settings": {
    "requestedThinking": "medium",
    "maxTokens": 16384,
    "contextWindow": 128000,
    "limits": {
      "timeoutMs": 600000,
      "maxToolCalls": 100,
      "maxCheckRuns": 12,
      "firstWriteMs": "UNKNOWN"
    },
    "server": {
      "id": "UNKNOWN",
      "version": "UNKNOWN"
    }
  },
  "promptHashes": {
    "before": "e3b0c44298fc1c149afbf4c8996fb92427ae41e4649b934ca495991b7852b855",
    "after": "fcba9272bc8e6af1ea127d9ce5864a5f11c0cbfe60b14854149d7894c63eb299"
  },
  "evidence": null,
  "independentVerification": {
    "status": "unverified",
    "refs": [
      {
        "path": "profiles/instructions/_evidence/proposal-gemma26.json",
        "sha256": "45f66b155e94807c91a74bb506d4f65042a043d026cf57849345f8f568a19112"
      }
    ]
  },
  "review": {
    "reviewer": "UNKNOWN",
    "refs": [],
    "exactBytesMatched": false,
    "sourceVerified": false
  },
  "limitations": [
    "No controlled A/B evidence has been run or independently verified; this card is a proposal only.",
    "Model version, quantization and server enforcement are UNKNOWN; the route alias and requested settings do not establish backend identity.",
    "THINKING_CONTROL_MISMATCH is recorded in the prepared settings metadata; server enforcement remains unverified.",
    "The candidate instructions are appended to the built-in harness and require an exact-match review before selection."
  ],
  "recommendation": "gather-more"
}
